{"$schema":"https://json-schema.org/draft/2020-12/schema","additionalProperties":false,"properties":{"authority_id":{"minLength":1,"type":"string"},"authority_type":{"const":"historical_evidence_authority"},"authorized_physical_path":{"pattern":"^[A-Za-z]:\\\\[^:]+$","type":"string"},"byte_size":{"const":2226181,"type":"integer"},"capture_attempt":{"minLength":1,"type":"string"},"evidence_role":{"minLength":1,"type":"string"},"immutable_provenance_root":{"pattern":"^[0-9a-f]{64}$","type":"string"},"logical_evidence_id":{"minLength":1,"type":"string"},"parser_authority_identity":{"pattern":"^[0-9a-f]{64}$","type":"string"},"path_normalization":{"minLength":1,"type":"string"},"schema_version":{"const":"6.0.0-DRAFT"},"sha256":{"pattern":"^[0-9A-F]{64}$","type":"string"},"source_external_root_id":{"minLength":1,"type":"string"}},"required":["authority_id","authority_type","authorized_physical_path","byte_size","capture_attempt","evidence_role","immutable_provenance_root","logical_evidence_id","parser_authority_identity","path_normalization","schema_version","sha256","source_external_root_id"],"title":"R4 historical evidence authority","type":"object"}
