{"authority_id":"RANDLE-R4-HISTORICAL-EVIDENCE-1","authority_type":"historical_evidence_authority","authorized_physical_path":"C:\\Users\\Trader\\OneDrive\\RandleRuntimeData\\provenance\\current_production_baseline_capture_20260720_retry1\\command_results\\18_broad_captured_entry_agent_pytest.log","byte_size":2226181,"capture_attempt":"current-production-baseline-capture-20260720-retry1","evidence_role":"HISTORICAL_BROAD_ENTRY_AGENT_PYTEST","immutable_provenance_root":"da82b0422da717427c0d9218f05b7d58bb8c7a52d5aafa24e0e8e1585fec785c","logical_evidence_id":"CURRENT-PRODUCTION-BASELINE-RETRY1-BROAD-PYTEST","parser_authority_identity":"f8a59b62b5297068a192d87ac5f1d124b568cc2892e47c9868a0807e68ee889a","path_normalization":"WINDOWS_ABSOLUTE_CASE_INSENSITIVE_PRIMARY_STREAM","schema_version":"6.0.0-DRAFT","sha256":"6F1B876C814B25D27F5EF8B4CFE3A66C4B0E847263FEC784C56896DC8FF3194A","source_external_root_id":"RANDLE-RUNTIME-PROVENANCE"}
